ชื่อการค้า,ชื่อเครื่องสำอาง,เลขที่ใบรับจดแจ้ง,ปีที่จดแจ้ง,ประเภทการจดแจ้ง,สถานะใบรับจดแจ้ง,วันที่อนุญาต,วันที่หมดอายุ,ชื่อผู้ประกอบการ,ชื่อและที่อยู่ผู้ผลิตต่างประเทศ,ชื่อผู้ว่าจ้างผลิต,เลขอ้างอิงสำหรับ,SKUs
วูเน่ WOONAE,อโล ซูทติ้ง เจล ALOE SOOTHING GEL,74-1-6800016890,68,ผลิต,ยกเลิก (6/6/2568),30/5/2568,6/6/2568,บริษัท อาร์ แอนด์ ดี อินเตอร์ แมนูแฟคเจอริ่ง จำกัด,-,บริษัท เนเจอร์อินอัส จำกัด,U1CM00074168000168901059018561C,
วูเน่ WOONAE,อโล ซูทติ้ง เจล ALOE SOOTHING GEL,74-1-6800017851,68,ผลิต,อนุมัติ,10/6/2568,9/6/2571,บริษัท อาร์ แอนด์ ดี อินเตอร์ แมนูแฟคเจอริ่ง จำกัด,-,บริษัท เนเจอร์อินอัส จำกัด,U1CM00074168000178511059018561C,
วูเน่ WOONAE,แอนตี้-เมลาสม่า สลีปปิ้ง มาส์ก ANTI-MELASMA SLEEPING MASK,12-1-6800008818,68,ผลิต,อนุมัติ,18/3/2568,17/3/2571,บริษัท พฤกษา แลบบอราเทอรี่ จำกัด,-,บริษัท เนเจอร์อินอัส จำกัด,U1CM00012168000088181266001121C,
วูเน่ WOONAE,บาร์บี้ ยัง พรี-เซรั่ม พลัส มาสก์ BARBIE YUNG PRE-SERUM + MASK,12-1-6800007505,68,ผลิต,อนุมัติ,6/3/2568,5/3/2571,บริษัท พฤกษา แลบบอราเทอรี่ จำกัด,-,บริษัท เนเจอร์อินอัส จำกัด,U1CM00012168000075051266001121C,
วูเน่ WOONAE,บิงซู ซอฟท์ ทิ้นท์ ลิป BINGSU SOFT TINT LIP,11-1-6800028133,68,ผลิต,ยกเลิก (29/9/2568),2/9/2568,29/9/2568,บริษัท ไมลอทท์ แลบบอราทอรีส์ จำกัด,-,บริษัท เนเจอร์อินอัส จำกัด,U1CM00011168000281331059030413C,
วูเน่ WOONAE,บิงซู ซอฟท์ ทิ้นท์ ลิป BINGSU SOFT TINT LIP,11-1-6800031744,68,ผลิต,อนุมัติ,30/9/2568,29/9/2571,บริษัท ไมลอทท์ แลบบอราทอรีส์ จำกัด,-,บริษัท เนเจอร์อินอัส จำกัด,U1CM00011168000317441059030413C,
วูเน่ WOONAE,แบล็ค โอนิกซ์ แมทท์ อายไลเนอร์ BLACK ONYX MATTE EYELINER,73-2-6800015400,68,นำเข้า,อนุมัติ,8/5/2568,7/5/2571,บริษัท เนเจอร์อินอัส จำกัด,"YIWU SAINT DAVIA COSMETICS CO.,LTD NO.1117,YONGJUN RD,HOUZHAI INDUSTRIAL ZONE, YIWU CITY, , PEOPLE’S REPUBLIC OF CHINA",,U1CM00073268000154007367000641C,
วูเน่ WOONAE,แบล็คกี้ ยัง เคิร์ล มาสแคร์ BLACKY YUNG CURL MASCARE,11-1-6800022938,68,ผลิต,อนุมัติ,22/7/2568,21/7/2571,บริษัท เวก้าเนเจอรัล จำกัด,-,บริษัท เนเจอร์อินอัส จำกัด,U1CM00011168000229381165000691C,
วูเน่ WOONAE,แบล็คกี้ ยัง อายแลช มาสแคร์ BLACKY YUNG EYELASH MASCARE,11-1-6800001252,68,ผลิต,อนุมัติ,14/1/2568,13/1/2571,บริษัท เวก้าเนเจอรัล จำกัด,-,บริษัท เนเจอร์อินอัส จำกัด,U1CM00011168000012521165000691C,
วูเน่ WOONAE,บราวนี่ ยัง อายแลช มาสแคร์ BROWNIE YUNG EYELASH MASCARE,11-1-6800001258,68,ผลิต,อนุมัติ,14/1/2568,13/1/2571,บริษัท เวก้าเนเจอรัล จำกัด,-,บริษัท เนเจอร์อินอัส จำกัด,U1CM00011168000012581165000691C,
วูเน่ WOONAE,แคนดี้ คิส เกลซซิ่ง ลิป CANDY KISS GLAZZING LIP,12-1-6800009782,68,ผลิต,อนุมัติ,26/3/2568,25/3/2571,บริษัท พฤกษา แลบบอราเทอรี่ จำกัด,-,บริษัท เนเจอร์อินอัส จำกัด,U1CM00012168000097821266001124C,
วูเน่ WOONAE,ซีซี เบลอริ่ง ครีม เอสพีเอฟ 50 พีเอ+++ CC BLURRING CREAM SPF 50 PA+++,13-1-6800003633,68,ผลิต,อนุมัติ,3/2/2568,2/2/2571,บริษัท ไอพลัส แลบบอราทอรี่ จำกัด,-,บริษัท เนเจอร์อินอัส จำกัด,U1CM00013168000036331363001134C,
วูเน่ WOONAE,เคลียร์ลี่ ยัง พรี-เซรั่ม พลัส มาสก์ CLEARLY YUNG PRE-SERUM + MASK,12-1-6800000771,68,ผลิต,อนุมัติ,9/1/2568,8/1/2571,บริษัท พฤกษา แลบบอราเทอรี่ จำกัด,-,บริษัท เนเจอร์อินอัส จำกัด,U1CM00012168000007711266001121C,
วูเน่ WOONAE,คลาวดี้ ลูส พาวเดอร์ CLOUDY LOOSE POWDER,11-1-6800011286,68,ผลิต,อนุมัติ,9/4/2568,8/4/2571,บริษัท ไมลอทท์ แลบบอราทอรีส์ จำกัด,-,บริษัท เนเจอร์อินอัส จำกัด,U1CM00011168000112861059030412C,
วูเน่ WOONAE,คัตเตอร์ อายบราว เพนซิล CUTTER EYEBROW PENCIL,73-2-6800033170,68,นำเข้า,อนุมัติ,12/9/2568,11/9/2571,บริษัท เนเจอร์อินอัส จำกัด,"FUTURE LAB CO., LTD 1ST FLOOR OF NO18-2, YIHENG ROAD, XINGONGYE ROAD, QINGHU VILLIAGE, JUNHE STREET, BAIYUN DISTRICT GUANGZHOU CITY, GUANGDONG PROVONCE , PEOPLE’S REPUBLIC OF CHINA",,U1CM00073268000331707367000643C,
วูเน่ WOONAE,ดิวอี้ ยัง พรี-เซรั่ม พลัส มาสก์ DEWEY YUNG PRE-SERUM + MASK,12-1-6800000647,68,ผลิต,อนุมัติ,9/1/2568,8/1/2571,บริษัท พฤกษา แลบบอราเทอรี่ จำกัด,-,บริษัท เนเจอร์อินอัส จำกัด,U1CM00012168000006471266001121C,
วูเน่ WOONAE,โกลว์วี่ ยัง พรี-เซรั่ม พลัส มาสก์ GLOWY YUNG PRE-SERUM + MASK,12-1-6800000644,68,ผลิต,อนุมัติ,9/1/2568,8/1/2571,บริษัท พฤกษา แลบบอราเทอรี่ จำกัด,-,บริษัท เนเจอร์อินอัส จำกัด,U1CM00012168000006441266001121C,
วูเน่ WOONAE,คิส ล็อค ซาติน ลิป KISS LOCK SATIN LIP,11-1-6800028564,68,ผลิต,อนุมัติ,5/9/2568,4/9/2571,บริษัท ไมลอทท์ แลบบอราทอรีส์ จำกัด,-,บริษัท เนเจอร์อินอัส จำกัด,U1CM00011168000285641059030413C,
วูเน่ WOONAE,มณีแดง ไทม์เลส คอลลาเจน มาส์ก MANEE DANG TIMELESS COLLAGEN MASK,73-2-6800031867,68,นำเข้า,อนุมัติ,2/9/2568,1/9/2571,บริษัท เนเจอร์อินอัส จำกัด,"GUANGDONG BITING COSMETICS CO., LTD. FLOOR 1 TO 2,8 BUILDING,D DISTRICT,WANGYANGZHONGCHUANG, GUANGDE ZONE YINGHONG TOWN,YINGDE CITY,GUANGDONG PROVINCE. , PEOPLE’S REPUBLIC OF CHINA",,U1CM00073268000318677367000641C,
วูเน่ WOONAE,พีช คอลลาเจน ไฮยา เก้าเอ็กซ์ เซรั่ม PEACH COLLAGEN HYA 9X SERUM,12-1-6800008985,68,ผลิต,อนุมัติ,19/3/2568,18/3/2571,บริษัท พฤกษา แลบบอราเทอรี่ จำกัด,-,บริษัท เนเจอร์อินอัส จำกัด,U1CM00012168000089851266001121C,
วูเน่ WOONAE,สกิน ฟิต ไมโครไฟเบอร์ ไบรท์ & เรเดียนท์ อินเทนซ์ มาส์ก SKIN FIT MICROFIBER BRIGHT & REDIANT INTENSE MASK,73-2-6800034031,68,นำเข้า,อนุมัติ,18/9/2568,17/9/2571,บริษัท เนเจอร์อินอัส จำกัด,"GUANGZHOU XUJOHN BIO-TECHNIQUE CO., LTD. NO.1 BUILDING, THE 7TH YARD, LIANDA ROAD, HUANGPU DISTRICT GUANGZHOU , PEOPLE’S REPUBLIC OF CHINA",,U1CM00073268000340317367000641C,
วูเน่ WOONAE,สมูทตี้ ไฟน์ ไลเนอร์ #01 ช็อกโกแลต นัวร์ SMOOTHIE FINE LINER #01 CHOCOLATE NOIR,73-2-6800024842,68,นำเข้า,อนุมัติ,15/7/2568,14/7/2571,บริษัท เนเจอร์อินอัส จำกัด,"KAIYA COSMETICS CO.,LTD. DASHENG PLANT DALU, JINPING DISTRICT, SHANTOU CITY, GUANGDONG PROVINCE , PEOPLE’S REPUBLIC OF CHINA",,U1CM00073268000248427367000641C,
วูเน่ WOONAE,ซูการ์ ริง ทินท์ บาล์ม SUGAR RING TINT BALM,11-1-6800019728,68,ผลิต,อนุมัติ,25/6/2568,24/6/2571,บริษัท ไมลอทท์ แลบบอราทอรีส์ จำกัด,-,บริษัท เนเจอร์อินอัส จำกัด,U1CM00011168000197281059030415C,
วูเน่ WOONAE,ซูการ์ ริง ทินท์ บาล์ม #01 เชอร์รี่ ป็อป SUGAR RING TINT BALM #01 CHERRY POP,11-1-6800019727,68,ผลิต,อนุมัติ,25/6/2568,24/6/2571,บริษัท ไมลอทท์ แลบบอราทอรีส์ จำกัด,-,บริษัท เนเจอร์อินอัส จำกัด,U1CM00011168000197271059030411C,
วูเน่ WOONAE,ซูการ์ ริง ทินท์ บาล์ม #07 คลาวดี้ บีม SUGAR RING TINT BALM #07 CLOUDY BEAM,11-1-6800019731,68,ผลิต,อนุมัติ,25/6/2568,24/6/2571,บริษัท ไมลอทท์ แลบบอราทอรีส์ จำกัด,-,บริษัท เนเจอร์อินอัส จำกัด,U1CM00011168000197311059030411C,
วูเน่ WOONAE,สวีท วิง อายไลเนอร์ #01 ช็อกโกแลต นัวร์ SWEET WING EYELINER #01 CHOCOLATE NOIR,73-2-6800012921,68,นำเข้า,อนุมัติ,18/4/2568,17/4/2571,บริษัท เนเจอร์อินอัส จำกัด,"KAIYA COSMETICS CO.,LTD. DASHENG PLANT DALU, JINPING DISTRICT, SHANTOU CITY, GUANGDONG PROVINCE , PEOPLE’S REPUBLIC OF CHINA",,U1CM00073268000129217367000641C,
วูเน่ WOONAE,วิตซี เซรั่ม VIT C SERUM,12-1-6800002151,68,ผลิต,อนุมัติ,21/1/2568,20/1/2571,บริษัท พฤกษา แลบบอราเทอรี่ จำกัด,-,บริษัท เนเจอร์อินอัส จำกัด,U1CM00012168000021511266001121C,
วูเน่ WOONAE,เวคอัพ พิงค์ คอลลาเจน มาส์ก WAKE UP PINK COLLAGEN MASK,73-2-6800032309,68,นำเข้า,อนุมัติ,5/9/2568,4/9/2571,บริษัท เนเจอร์อินอัส จำกัด,"GUANGDONG BITING COSMETICS CO., LTD. FLOOR 1 TO 2,8 BUILDING,D DISTRICT,WANGYANGZHONGCHUANG, GUANGDE ZONE YINGHONG TOWN,YINGDE CITY,GUANGDONG PROVINCE. , PEOPLE’S REPUBLIC OF CHINA",,U1CM00073268000323097367000641C,
วูเน่ WOONAE,วอเตอร์ ทินท์ ลิป เลิฟ WATER TINT LIP LOVE,11-1-6800029168,68,ผลิต,ยกเลิก (30/9/2568),10/9/2568,30/9/2568,บริษัท ไมลอทท์ แลบบอราทอรีส์ จำกัด,-,บริษัท เนเจอร์อินอัส จำกัด,U1CM00011168000291681059030413C,
วูเน่ WOONAE,วอเตอร์ ทินท์ ลิป เลิฟ WATER TINT LIP LOVE,11-1-6800031911,68,ผลิต,อนุมัติ,1/10/2568,30/9/2571,บริษัท ไมลอทท์ แลบบอราทอรีส์ จำกัด,-,บริษัท เนเจอร์อินอัส จำกัด,U1CM00011168000319111059030413C,
